"nomer","address","coordinates","info","url_maps"
0,"Советская улица, 3/8, Любим, Ярославская область","58.361711, 40.687412","Два столетия назад, в первой половине девятнадцатого века, когда Любим еще дышал размеренной жизнью уездного городка, купец Войлочников, заработавший состояние на лесных промыслах, возвел в самом сердце города добротный дом, ставший местной достопримечательностью, символом достатка и процветания. Сегодня он, как объект культурного наследия, хранит в себе отголоски той эпохи. За долгие годы здание повидало многое. В советское время здесь кипела жизнь: сначала в нём располагались райисполком, райком комсомола, и горисполком. Казалось, дух купеческой основательности сменился духом революционных преобразований. Но время неумолимо, и сегодня в стенах старинного дома царит совсем иная атмосфера. Здесь регистрируют браки в ЗАГСе, бережно хранят историю в районном архиве, а в уютном кафе ""Старый Дворик"" можно отдохнуть и насладиться тишиной, вспоминая о прошлом, в котором купец Войлочников, несомненно, был бы доволен тем, что его дом продолжает жить и служить людям.","https://yandex.ru/maps/20592/lyubim/house/sovetskaya_ulitsa_3_8/YEkYcA9nTUQFQFtifX93cHtiZQ==/?ll=40.688112%2C58.361560&z=18.7"
1,"Советская улица, 9/23, Любим, Ярославская область","58.360446, 40.688131","Купеческий род Лобановых, прославившийся успешными фабрикантами и заводчиками, оставил заметный след в истории Ярославской губернии. В зените своего могущества, в конце XIX века, Николай Николаевич Лобанов, продолжатель купеческой династии, воздвиг в Любиме величественный каменный особняк. Этот дом стал не только символом их процветания, но и архитектурной жемчужиной города. Двухэтажное здание с мезонином, выполненное в стиле классицизма, поражало своим изяществом и величием. Первый этаж занимала кожевенная мастерская, сердце семейного дела, а второй служил роскошной резиденцией, где кипела жизнь именитого семейства. Белоснежные пилястры, лепные лучковые сандрики и выразительный зубчатый фриз украшали жилой этаж, подчеркивая статус и вкус владельцев. Однако благополучие Лобановых было омрачено революционными событиями 1917 года. В 1918 году их имущество было национализировано советской властью, что стало сокрушительным ударом для семьи. В этот же трагический период от сильного расстройства нервов скончалась Вера Михайловна, жена Николая Николаевича. Оставшись один, лишенный всего, Николай Николаевич Лобанов покинул Любим, оставив позади дом, дело и память о былом величии. Его дальнейшая судьба окутана тайной, а следы затерялись в бурной истории XX века. Особняк же, пережив хозяев и эпоху, и по сей день возвышается в Любиме, напоминая о купеческом роде Лобановых и их вкладе в развитие города.","https://yandex.ru/maps/20592/lyubim/house/sovetskaya_ulitsa_9_23/YEkYcA9oSEYGQFtifX93cXhnYg==/?ll=40.684860%2C58.361116&z=17.03"
2,"Советская улица, 13, Любим, Ярославская область","58.359408, 40.688643","Старое здание, возвышающееся над сонными улочками Любима, дышит историей. Его обветшалый фасад, украшенный лепниной, помнит гимназистов в строгих мундирах, спешащих на уроки латыни и математики. Шепот времени доносит эхо их юных голосов, споры у доски и тайные вздохи. Кажется, что солнечные лучи, проникающие сквозь высокие окна, все еще хранят отблески их радости и надежд. Годы революции, словно бурный ветер, пронеслись над этими стенами. Здесь звучали другие речи, сменялись флаги, но здание, как верный страж, продолжало стоять, наблюдая за сменой эпох. Потом гимназия превратилась в школу, затем в профтехучилище, и вот теперь – корпус Любимского Аграрного Политехнического колледжа. Запах свежеиспеченного хлеба и аромат пряных трав сменили запах чернил и пыли учебников. В просторных классах, где когда-то разбирали теоремы, теперь кипит работа: будущие повара творят кулинарные шедевры. Слышен звон посуды, шелест ножей и приглушенные голоса преподавателей, делящихся секретами мастерства. Но дух прошлого никуда не исчез. Он ощущается в высоких потолках, в скрипучих ступенях старой лестницы, в старинной печи, которую, говорят, использовали еще гимназисты для приготовления рождественских пряников. И кто знает, может быть, когда студенты устало опускаются на подоконник, глядя на закат, им слышится эхо прошлого, шепчущее о мечтах и надеждах, которые, как и стены этого старого здания, вечны.","https://yandex.ru/maps/20592/lyubim/house/sovetskaya_ulitsa_13/YEkYcA9oT0EEQFtifX90eHhjbA==/?ll=40.688292%2C58.359688&z=17.03"
3,"улица Ленина, 21/4, Любим, Ярославская область","58.360371, 40.687394","На перекрёстке улиц Ленина и Советской стоит здание, чья история окутана тайнами и легендами. Сегодня это главный корпус Любимского аграрного политехнического колледжа, но его прошлое уходит корнями вглубь веков, задолго до революции. Поговаривают, что изначально оно было построено как общежитие для священнослужителей. Архитектура здания, с его массивными стенами, несет отпечаток старины. Кирпич, из которого оно сложено, помнит множество поколений, видевших смену эпох и укладов. Внутри, за толстыми стенами, царит особая атмосфера, пропитанная духом минувших дней. Местные жители рассказывают, что по ночам в коридорах здания слышатся тихие голоса и шаги. Студенты, учащиеся здесь, уверяют, что иногда видят тени, мелькающие в полумраке. Легенды гласят, что души священнослужителей, некогда живших в этом здании, до сих пор бродят по его коридорам, охраняя свою обитель. Конечно, рациональные умы объясняют эти явления сквозняками и игрой теней, но мистическая аура здания продолжает будоражить воображение. И каждый, кто переступает порог Любимского аграрного политехнического колледжа, невольно ощущает связь времен, чувствуя дыхание истории, запечатленное в его стенах. Это место, где прошлое встречается с настоящим, где легенды переплетаются с реальностью, создавая неповторимую атмосферу загадочности и величия.","https://yandex.ru/maps/20592/lyubim/house/ulitsa_lenina_21_4/YEkYcA9nSkwDQFtifX93cX9kZQ==/?ll=40.688292%2C58.359688&z=17.03"
4,"Красноармейская улица, 1, Любим, Ярославская область","58.361820, 40.683460","Двухэтажное здание на Красноармейской, с вывесками продуктового и рыболовного магазинов, помнит иные времена, когда здесь гулко стучали молотки, пахло кожей и дубильными веществами, а гомон рабочих смешивался с властным голосом Николая Николаевича Лобанова. В этом доме кипела жизнь, двигатель которой – кожевенное дело, основа процветания династии Лобановых. Николай Николаевич, статный мужчина с окладистой бородой, был не только купцом, но и рачительным хозяином. Он лично следил за качеством выделки, закупал лучшие сорта кож, контролировал каждый этап производства. Его уважали за справедливость и строгость, а его товар ценился далеко за пределами Любима. Мастерская была его детищем, местом, где он проводил большую часть времени, вкладывая душу в каждый лоскут кожи. Но не только делами был жив Лобанов. В просторных комнатах их дома царил уют, созданный руками его любимой супруги, Веры Михайловны. Их жизнь, казалось, была предопределена к счастью и достатку, но вихрь революции безжалостно разрушил этот уклад. Национализация имущества, страх, неопределенность – все это тяжким бременем легло на плечи Лобановых. Вера Михайловна, хрупкая и болезненная, не смогла перенести потрясений. Ее безвременная кончина стала для Николая Николаевича страшным ударом. Он потерял не только свое дело, но и смысл жизни. Оставив родной Любим, он словно растворился в тумане истории, оставив после себя лишь молчаливые стены мастерской, ныне хранящие отголоски былого величия.","https://yandex.ru/maps/20592/lyubim/house/krasnoarmeyskaya_ulitsa_1/YEkYcA9jTUMHQFtifX93cHRhZA==/?ll=40.684570%2C58.361353&z=17"
5,"улица Раевского, 4, Любим, Ярославская область","58.362259, 40.689775","В самом сердце Любима, небольшого городка Ярославской области, возвышается здание, пропитанное духом истории. Построенное в XIX веке, оно несет на себе отпечаток времени, словно запечатленные страницы ушедшей эпохи. В его архитектуре, сдержанной и элегантной, угадываются черты классицизма, характерные для провинциальных построек того времени. Изначально, это здание служило земской аптекой. Здесь, за крепкими стенами, заботились о здоровье жителей уезда, приготавливали лекарства по старинным рецептам и давали надежду на исцеление. Представьте, сколько людей переступило порог этой аптеки, ища облегчения от недугов и болезней! Ароматы трав и микстур, тихий шепот провизора, звяканье склянок – все это было частью повседневной жизни этого места. После революции, когда уклад жизни кардинально изменился, здание сменило свое предназначение. Земская аптека уступила место Центру Обеспечения Функционирования Образовательных Учреждений и Отделу Образования Администрации Любимского Муниципального района. Теперь в его стенах кипит работа по организации образовательного процесса, планированию и реализации образовательных программ. Несмотря на перемены, здание сохранило свой исторический облик и остается важной частью архитектурного ансамбля Любима. Оно является живым свидетелем минувших лет, связующим звеном между прошлым и настоящим. Его стены, помнящие голоса провизоров и посетителей аптеки, теперь слушают обсуждения педагогов и чиновников от образования. Это здание – не просто строение, это символ непрерывности истории, символ служения обществу, независимо от времени и обстоятельств.","https://yandex.ru/maps/20592/lyubim/house/ulitsa_rayevskogo_4/YEkYcA9pTkICQFtifX93c35mbQ==/?ll=40.696599%2C58.362237&z=16.24"
6,"улица Раевского, 15, Любим, Ярославская область","58.361811, 40.693682","Поодаль от центра старинного Любима стоит дом, хранящий в своих стенах историю одного из самых уважаемых горожан – купца Геннадия Васильевича Яровицына. Этот каменный особняк, ныне занимаемый Отделом полиции МВД России по Любимскому району, был возведен после страшного пожара, и стал символом возрождения и процветания, олицетворением неукротимого духа самого Яровицына. Геннадий Васильевич, купец 2-й гильдии, был не просто успешным торговцем, но и человеком, глубоко преданным своему городу. Его имя знали не только благодаря лавкам с мучным и бакалейным товаром в Гостином дворе, но и как городского головы, чьи решения определяли судьбу Любима. Он был старостой Предтечевской церкви на Нижнем Посаде, и именно благодаря его щедрости был восстановлен зимний храм после огненной стихии 1897 года. Яровицын был истинным благотворителем, попечителем любимской городской богадельни. Его забота о нуждающихся и обездоленных снискала ему всеобщую любовь и уважение. Каждый кирпичик его дома, каждый предмет утвари, казалось, дышали историей, напоминая о делах милосердия и благородстве его владельца. После кончины Геннадия Васильевича в 1908 году, его дом продолжал жить своей жизнью, сменяя владельцев и назначение. Но и сегодня, когда в его стенах располагается учреждение правопорядка, он не утратил своего величия и значимости. Каменный особняк на улице Раевского — это не просто здание, это живая память о купце Яровицыне, о его вкладе в развитие Любима, о его доброте и щедрости, которые и по сей день вдохновляют жителей этого старинного города.","https://yandex.ru/maps/20592/lyubim/house/ulitsa_rayevskogo_15/YEkYcA5jT00FQFtifX93cHRiZQ==/?ll=40.691488%2C58.361589&z=17.03"
7,"улица Набережная реки Обноры, 1, Любим, Ярославская область","58.364025, 40.697976","На берегу тихой реки, словно старый страж, стоит величественное здание. Его история уходит корнями в прошлое, когда оно служило земской больницей, принося облегчение и надежду больным. Кирпичные стены хранили отпечатки времени, а высокие окна смотрели на реку, словно вспоминая дни, полные тепла и сострадания. С годами мир менялся, потребности людей трансформировались. Земская больница утратила своё первоначальное предназначение. Пустые коридоры, когда-то наполненные шёпотом врачей и стонами больных, погрузились в тишину. Здание казалось заброшенным, словно забытый исполин, ожидающий своей участи. Но судьба распорядилась иначе. Взгляд властей обратился на это историческое строение. Государственные органы, нуждавшиеся в просторном и представительном здании, нашли в нём идеальное место. Ремонтные работы вернули зданию былое величие. Старые перегородки были снесены, создавая просторные кабинеты, а окна вновь засияли, отражая блеск реки. Сегодня в стенах бывшей больницы кипит жизнь государственных служащих.  Документы летят по столам, звонят телефоны, ведутся важные переговоры. Здание, когда-то служившее для исцеления тел, теперь стало символом государственной власти, продолжая свою историю на берегах реки.  И каждый день, глядя на отражение в воде, оно словно вспоминает своё прошлое, тихо шепча о днях земской больницы, о людях, которых оно лечило, и о надежде, которую дарило.","https://yandex.ru/maps/20592/lyubim/house/ulitsa_naberezhnaya_reki_obnory_1/YEkYcA5nQEIBQFtifX93dXxhYQ==/?ll=40.697881%2C58.364166&z=17"
